{
  "schema": 2,
  "revision": "2026-09-20",
  "groups": [
    {
      "id": "id",
      "name": "Indonesia",
      "description": "Domestic path. WARP should NOT improve these; they act as the control that shows the effect is specific to international transit."
    },
    { "id": "sg", "name": "Singapore" },
    { "id": "jp", "name": "Tokyo" },
    { "id": "eu", "name": "Europe" },
    { "id": "us", "name": "United States" }
  ],
  "servers": [
    {
      "id": "id-cf-cgk",
      "group": "id",
      "name": "Cloudflare edge (nearest colo, typically CGK)",
      "provider": "Cloudflare",
      "protocol": "cloudflare",
      "ping_host": "speed.cloudflare.com",
      "download_url": "https://speed.cloudflare.com/__down",
      "upload_url": "https://speed.cloudflare.com/__up",
      "capabilities": ["ping", "download", "upload", "timings"],
      "tier": "quick",
      "flags": ["footnote:cloudflare-edge"],
      "notes": "Anycast: the colo actually used is read from the trace endpoint and recorded per phase. With WARP enabled this path never leaves Cloudflare's network, so it measures ISP-to-nearest-edge only and must not be read as an end-to-end international result."
    },
    {
      "id": "id-myrepublic-iperf3",
      "group": "id",
      "name": "MyRepublic Tangerang (iperf3)",
      "provider": "MyRepublic",
      "city": "Tangerang",
      "country": "ID",
      "protocol": "iperf3",
      "ping_host": "speedtest.tangerang2.myrepublic.net.id",
      "capabilities": ["ping", "download", "upload"],
      "tier": "quick",
      "flags": ["best-effort", "control:domestic"],
      "iperf3": {
        "host": "speedtest.tangerang2.myrepublic.net.id",
        "port_range": [9201, 9240],
        "reverse_download": true
      },
      "notes": "Domestic Indonesian iperf3 endpoint advertising both -R and -u. Community-listed, so availability is best-effort."
    },
    {
      "id": "id-datautama",
      "group": "id",
      "name": "Datautama Surabaya Ubuntu mirror",
      "provider": "Datautama",
      "city": "Surabaya",
      "country": "ID",
      "protocol": "http-file",
      "ping_host": "kartolo.sby.datautama.net.id",
      "download_url": "https://kartolo.sby.datautama.net.id/ubuntu/ls-lR.gz",
      "capabilities": ["ping", "download", "timings"],
      "tier": "extended",
      "flags": ["control:domestic"],
      "adapter_opts": { "min_bytes": 5000000, "max_bytes": 40000000 },
      "notes": "The only verified-alive domestic non-Cloudflare path. It is a public Ubuntu mirror rather than a speedtest service, so use is deliberately bounded: one ranged request per sample, byte cap applied, and an identifying User-Agent. Download only."
    },

    {
      "id": "sg-linode",
      "group": "sg",
      "name": "Linode Singapore",
      "provider": "Linode",
      "city": "Singapore",
      "country": "SG",
      "protocol": "http-file",
      "ping_host": "speedtest.singapore.linode.com",
      "download_url": "https://speedtest.singapore.linode.com/100MB-singapore.bin",
      "capabilities": ["ping", "download", "timings"],
      "tier": "quick"
    },
    {
      "id": "sg-leaseweb-iperf3",
      "group": "sg",
      "name": "Leaseweb Singapore (iperf3)",
      "provider": "Leaseweb",
      "city": "Singapore",
      "country": "SG",
      "protocol": "iperf3",
      "ping_host": "speedtest.sin1.sg.leaseweb.net",
      "capabilities": ["ping", "download", "upload"],
      "tier": "quick",
      "flags": ["best-effort"],
      "iperf3": {
        "host": "speedtest.sin1.sg.leaseweb.net",
        "port_range": [5201, 5210],
        "reverse_download": true
      },
      "notes": "Provider-operated public iperf3 endpoint. Upload coverage for this group."
    },
    {
      "id": "sg-vultr",
      "group": "sg",
      "name": "Vultr Singapore",
      "provider": "Vultr",
      "city": "Singapore",
      "country": "SG",
      "protocol": "http-file",
      "ping_host": "sgp-ping.vultr.com",
      "download_url": "https://sgp-ping.vultr.com/vultr.com.100MB.bin",
      "capabilities": ["ping", "download", "timings"],
      "tier": "extended"
    },
    {
      "id": "sg-hetzner",
      "group": "sg",
      "name": "Hetzner Singapore",
      "provider": "Hetzner",
      "city": "Singapore",
      "country": "SG",
      "protocol": "http-file",
      "ping_host": "sin-speed.hetzner.com",
      "download_url": "https://sin-speed.hetzner.com/100MB.bin",
      "capabilities": ["ping", "download", "timings"],
      "tier": "extended"
    },
    {
      "id": "sg-ovh-iperf3",
      "group": "sg",
      "name": "OVH Singapore (iperf3)",
      "provider": "OVH",
      "city": "Singapore",
      "country": "SG",
      "protocol": "iperf3",
      "ping_host": "sgp.proof.ovh.net",
      "capabilities": ["ping", "download", "upload"],
      "tier": "extended",
      "flags": ["best-effort"],
      "iperf3": {
        "host": "sgp.proof.ovh.net",
        "port_range": [5201, 5210],
        "reverse_download": true
      }
    },

    {
      "id": "jp-linode",
      "group": "jp",
      "name": "Linode Tokyo 2",
      "provider": "Linode",
      "city": "Tokyo",
      "country": "JP",
      "protocol": "http-file",
      "ping_host": "speedtest.tokyo2.linode.com",
      "download_url": "https://speedtest.tokyo2.linode.com/100MB-tokyo.bin",
      "capabilities": ["ping", "download", "timings"],
      "tier": "quick"
    },
    {
      "id": "jp-leaseweb-iperf3",
      "group": "jp",
      "name": "Leaseweb Tokyo (iperf3)",
      "provider": "Leaseweb",
      "city": "Tokyo",
      "country": "JP",
      "protocol": "iperf3",
      "ping_host": "speedtest.tyo11.jp.leaseweb.net",
      "capabilities": ["ping", "download", "upload"],
      "tier": "quick",
      "flags": ["best-effort"],
      "iperf3": {
        "host": "speedtest.tyo11.jp.leaseweb.net",
        "port_range": [5201, 5210],
        "reverse_download": true
      },
      "notes": "Upload coverage for this group. The one APAC LibreSpeed server (librespeed.a573.net) returns 403 and is deliberately excluded."
    },
    {
      "id": "jp-vultr",
      "group": "jp",
      "name": "Vultr Tokyo",
      "provider": "Vultr",
      "city": "Tokyo",
      "country": "JP",
      "protocol": "http-file",
      "ping_host": "hnd-jp-ping.vultr.com",
      "download_url": "https://hnd-jp-ping.vultr.com/vultr.com.100MB.bin",
      "capabilities": ["ping", "download", "timings"],
      "tier": "extended"
    },

    {
      "id": "eu-hetzner-fsn1",
      "group": "eu",
      "name": "Hetzner Falkenstein",
      "provider": "Hetzner",
      "city": "Falkenstein",
      "country": "DE",
      "protocol": "http-file",
      "ping_host": "fsn1-speed.hetzner.com",
      "download_url": "https://fsn1-speed.hetzner.com/100MB.bin",
      "capabilities": ["ping", "download", "timings"],
      "tier": "quick"
    },
    {
      "id": "eu-ls-ams-clouvider",
      "group": "eu",
      "name": "LibreSpeed Amsterdam (Clouvider)",
      "provider": "Clouvider",
      "city": "Amsterdam",
      "country": "NL",
      "protocol": "librespeed",
      "ping_host": "ams.speedtest.clouvider.net",
      "download_url": "https://ams.speedtest.clouvider.net/backend/garbage.php",
      "upload_url": null,
      "capabilities": ["ping", "download", "timings"],
      "tier": "extended",
      "flags": ["best-effort"],
      "notes": "Download only. This deployment answers 413 Payload Too Large for uploads above roughly 1 MB (verified: 1 MB accepted, 20 MB rejected), so it cannot measure a sustained upload. Appears on the canonical librespeed.org community list."
    },
    {
      "id": "eu-ls-prg-cesnet",
      "group": "eu",
      "name": "LibreSpeed Prague (CESNET)",
      "provider": "CESNET",
      "city": "Prague",
      "country": "CZ",
      "protocol": "librespeed",
      "ping_host": "speedtest.cesnet.cz",
      "download_url": "https://speedtest.cesnet.cz/backend/garbage.php",
      "upload_url": "https://speedtest.cesnet.cz/backend/empty.php",
      "capabilities": ["ping", "download", "upload", "timings"],
      "tier": "quick",
      "flags": ["best-effort"],
      "notes": "Carries the EU upload leg in quick mode: verified to accept a 20 MB upload."
    },
    {
      "id": "eu-ls-hel",
      "group": "eu",
      "name": "LibreSpeed Helsinki",
      "provider": "librespeed.fi",
      "city": "Helsinki",
      "country": "FI",
      "protocol": "librespeed",
      "ping_host": "www.librespeed.fi",
      "download_url": "https://www.librespeed.fi/backend/garbage.php",
      "upload_url": "https://www.librespeed.fi/backend/empty.php",
      "capabilities": ["ping", "download", "upload", "timings"],
      "tier": "extended",
      "flags": ["best-effort"]
    },
    {
      "id": "eu-ls-fra-clouvider",
      "group": "eu",
      "name": "LibreSpeed Frankfurt (Clouvider)",
      "provider": "Clouvider",
      "city": "Frankfurt",
      "country": "DE",
      "protocol": "librespeed",
      "ping_host": "fra.speedtest.clouvider.net",
      "download_url": "https://fra.speedtest.clouvider.net/backend/garbage.php",
      "upload_url": null,
      "capabilities": ["ping", "download", "timings"],
      "tier": "extended",
      "flags": ["best-effort"],
      "notes": "Download only: like its Amsterdam sibling, this deployment answers 413 for uploads above roughly 1 MB."
    },
    {
      "id": "eu-ls-prg-turris",
      "group": "eu",
      "name": "LibreSpeed Prague (Turris)",
      "provider": "Turris",
      "city": "Prague",
      "country": "CZ",
      "protocol": "librespeed",
      "ping_host": "librespeed.turris.cz",
      "download_url": "https://librespeed.turris.cz/backend/garbage.php",
      "upload_url": "https://librespeed.turris.cz/backend/empty.php",
      "capabilities": ["ping", "download", "upload", "timings"],
      "tier": "extended",
      "flags": ["best-effort"]
    },
    {
      "id": "eu-hetzner-hel1",
      "group": "eu",
      "name": "Hetzner Helsinki",